{
  "$schema": "https://json-schema.org/draft/2020-12/schema",
  "$id": "location.schema.json",
  "title": "Location",
  "description": "A place on the campaign map: a district, a building or block, or a pinned point. One file per location in data/locations/. Produced by promoting a drawn shape once its lore has been written together, not authored from scratch -- drawn and promoted from inside Foundry itself by the Location Editor (design/location-editor.md); tools/gazetteer/ was fully retired 2026-09-29, design/location-editor.md §10 phase 6. geometry.rings is canonical (lon/lat, WGS84); everything under `derived` is recomputed from it and must never be hand-edited. `realWorld` is research about the real Kobe geography this map was drawn from -- material for writing a convincing place, never itself canon, and no string from it may appear verbatim in `lore`. Ownership split (design/data-ownership.md): `geometry`/`derived`/`pinAnchor` are `lifecycle`-owned by the Location Editor alone (see their own `$comment`s) -- name/nameJa/kind/tags/rank/classification/depth/lore/scene.hooks+activities/authoring.note are `promotable`: either the Location Editor or Claude may write them, with clash detection in tools/location-sync (design/location-editor.md §5,6), same doctrine as design/scene-edits.md.",
  "type": "object",
  "required": ["$schema", "id", "type", "tier", "geometry", "derived", "authoring"],
  "additionalProperties": false,
  "properties": {
    "$schema": { "type": "string" },
    "id": { "type": "string" },
    "type": { "const": "location" },

    "tier": {
      "enum": ["region", "site", "point"],
      "description": "region: a district -- regions tessellate, and the goal is the whole map broken into them. site: a building, complex or block inside a region. point: a pin with a story and no footprint."
    },

    "name": { "type": ["string", "null"] },
    "nameJa": { "type": ["string", "null"] },
    "namingPlaceholderRef": { "type": ["string", "null"] },

    "kind": {
      "type": "string",
      "description": "A short, blunt classifier for sorting and map colour -- district / quarter / waterfront / industrial / residential / civic / commercial / transport / military / green / water / landmark / ruin / infrastructure / other, or blank. Not the terrain system; finer character belongs in lore.summary, where it can be prose."
    },

    "tags": {
      "type": "array",
      "description": "Freeform structural markers, same convention as a gazetteer session item's own `tags`. Notably 'underground': tools/location-sync/coverage.py excludes a region carrying it from the surface-tessellation and overlap checks, since it occupies the same footprint as whatever district sits above it -- a real Z-axis stack the tessellation has no way to represent in two dimensions, not an overlap to report.",
      "items": { "type": "string" }
    },

    "rank": {
      "type": ["integer", "null"],
      "minimum": 1,
      "maximum": 5,
      "description": "How much this place matters to the plot, 1 being the most important (Central Fortification is rank 1). A SEPARATE axis from `depth`, though informed by it: `depth` is how much has been written, `rank` is how much process the place earns -- how many passes of writing and revision before it counts as finished, and how hard Claude must check narrative decisions with Ingram before committing them rather than deciding alone. The two can legitimately disagree: somewhere seen once but pivotal is rank 1 at depth sketch; somewhere returned to constantly but incidental is rank 4 at depth standing. Null means not yet ranked. Rungs: 1 pivotal (the campaign turns on it) / 2 major (a named, recurring place with real consequence) / 3 supporting (a scene happens here) / 4 colour (texture, walked past) / 5 background (exists for the map to be complete). See design/location-rank.md for what each rung obliges.",
      "default": null
    },

    "classification": {
      "type": ["string", "null"],
      "enum": ["public", "internal", "secret", "classified", "top-secret", "omega-zero", null],
      "description": "Whether this place's own EXISTENCE and purpose are secret -- a different axis from design/strategy-layer.md's Clearance rungs, which gate how far a party that already knows a place exists may go INSIDE it once they're there. Null (the default, and correct for almost everything) means undeclared -- most locations have nothing to say here and showing up on an ordinary map is the whole point of them. The first five tiers are the same real Japanese document-classification ladder already used for text (ideas/entries/redacted-document-chain.json: 公開/部外秘/秘/機密/極秘 -- public/internal/secret/classified/top-secret) generalised from documents to places. 'omega-zero' sits above that ladder rather than extending it: a vanishingly rare tier for the handful of sites (The Rock is the first) whose existence is unknown even to most Directorate staff, not merely restricted. See design/strategy-layer.md's Site Classification section."
    },

    "depth": {
      "enum": ["named", "sketch", "scene", "standing"],
      "default": "named",
      "description": "How developed this location is supposed to be, and therefore what it owes -- see design/location-depth.md, enforced by tools/location-sync/core/depth.py. named: a purpose in one line, the bulk tier. sketch: a few paragraphs, enough for a brief moment in passing. scene: enough to run a full scene with the group, and the first depth that earns its own artwork, playlist and a named NPC. standing: returned to across the campaign, carrying history and consequence. DECLARED by hand, never inferred from how much text exists -- declaring it first makes it a commission rather than a description. Independent of `tier`, which is geometric scale: a region can be depth named and a point can be depth standing."
    },

    "geometry": {
      "type": "object",
      "$comment": "OWNER: location-editor. Once a location has been touched by the Location Editor (design/location-editor.md), only its harvest path (tools/location-sync) may write geometry -- the repo/Claude never hand-edits a shape. lon/lat is computed there from a Foundry-drawn shape via tools/location-sync/core/georef.py, kept deliberately server-side rather than ported to JS (design/location-editor.md §5 explains why).",
      "description": "Canonical. lon/lat (WGS84), never image pixels or map-frame metres -- design/map-generation.md: the frame's centre, rotation and extent have all changed before, and pixel coordinates would silently detach a location from its place the next time they do. Which of rings/point is required and non-empty depends on `tier` -- see the top-level `allOf` below.",
      "additionalProperties": false,
      "properties": {
        "rings": {
          "type": "array",
          "description": "One or more closed rings in GeoJSON Polygon order: the first ring is the shell, every ring after it is a hole punched in that shell -- never a second disjoint part. A site tier normally has exactly one (no holes); a region gains a second ring when another region's territory sits entirely inside it (The Open Sea holds The River Island this way). Each ring is [lon, lat] pairs. Consumed in this order by coverage.py's _to_polygon and built in this order by core/location.py's build_location. Empty for tier 'point', which has no footprint.",
          "items": {
            "type": "array",
            "minItems": 3,
            "items": {
              "type": "array",
              "items": { "type": "number" },
              "minItems": 2,
              "maxItems": 2
            }
          }
        },
        "point": {
          "type": ["array", "null"],
          "description": "For tier 'point' only: [lon, lat]. Null for region/site.",
          "items": { "type": "number" },
          "minItems": 2,
          "maxItems": 2
        }
      }
    },

    "pinAnchor": {
      "type": ["array", "null"],
      "$comment": "OWNER: location-editor. Same writer as geometry, same reasoning -- set from Places mode by dragging a location's pin independently of its footprint.",
      "description": "[lon, lat] -- where a Foundry map pin should actually sit. Null defaults to the area centroid, which lands badly on an L-shaped or annular footprint (a courtyard, a dock basin); set this explicitly once that matters.",
      "items": { "type": "number" },
      "minItems": 2,
      "maxItems": 2
    },

    "derived": {
      "type": "object",
      "$comment": "OWNER: location-editor. Same writer as geometry -- recomputed by tools/location-sync on every promotion/re-derive, never hand-edited by the repo/Claude.",
      "description": "Everything computable from geometry, recomputed on every promotion/re-derive and never hand-edited. Present so the file is readable and queryable without running the tool.",
      "additionalProperties": false,
      "properties": {
        "imagePx": { "description": "geometry.rings reprojected to campaign-map image pixels, same shape as geometry.rings. Null for tier 'point' -- there is no ring to reproject; see derived.centroidPx for the point's own pixel position.", "type": ["array", "null"] },
        "centroidPx": { "type": "array", "items": { "type": "number" }, "minItems": 2, "maxItems": 2 },
        "cells": { "type": "array", "items": { "type": "string" }, "description": "Every grid reference the shape touches -- tools/location-sync/core/grid.py's cell_coverage, area-exact." },
        "ref": { "type": ["string", "null"], "description": "The single reference to say aloud -- the cell the centroid falls in." },
        "areaM2": { "type": ["number", "null"] },
        "withinRegionRef": {
          "type": ["string", "null"],
          "description": "For a site or point: the region id whose area covers this location's centroid, by majority if more than one candidate region overlaps. Null if no region has been drawn over this ground yet, or for a region itself."
        },
        "containsRefs": {
          "type": "array",
          "description": "For a region: site/point location ids whose centroid falls inside it. Always empty for a site or point.",
          "items": { "type": "string" }
        },
        "neighbourRefs": {
          "type": "array",
          "description": "For a region: other region ids sharing a boundary. tools/location-sync/core/containment.py computes this correctly for draft items (it's what drives the drawing UI's tree and handoff views), but the promotion path does not yet carry it onto the promoted document -- build_location() still hardcodes this to empty, same shape as the scene/cross-ref gap that promotion once had, just not closed yet. A region tagged 'underground' (see top-level `tags`) legitimately has none either way: it sits entirely inside another region's footprint rather than bordering it.",
          "items": { "type": "string" }
        },
        "sourceSession": { "type": ["string", "null"], "description": "The gazetteer draft this was promoted from, for provenance." },
        "sourceLocalId": { "type": ["string", "null"], "description": "The item's localId within that session." },
        "promotedDate": { "type": ["string", "null"], "format": "date" }
      }
    },

    "authoring": {
      "description": "Shared lifecycle block (design/approvals-desk.md, common/authoring.schema.json) -- `note` is additionally required here, since every location is promoted from a gazetteer drawing session that always writes one.",
      "allOf": [
        { "$ref": "common/authoring.schema.json#/$defs/authoring" },
        { "required": ["note"] }
      ]
    },

    "lore": {
      "type": "object",
      "additionalProperties": false,
      "properties": {
        "summary": { "type": "string", "description": "A GM-facing paragraph: what this place is, in plain instructional sentences (see design/prose-craft-and-naming.md §1, the two registers)." },
        "playerFacing": { "type": "string", "description": "What a player would see/hear on arrival, or an Encyclopaedia-check reveal. Law 11: only what has actually been learned." },
        "gmOnly": { "type": "string", "description": "Anything hidden -- a Fact per design/npc-social-intel.md's pattern, a hook, a hazard." }
      }
    },

    "scene": {
      "type": "object",
      "description": "What makes this place playable rather than merely described. Required in increasing amounts from depth 'sketch' upward -- see design/location-depth.md's requirements table. Absent or empty for a depth-'named' location, which is correct: a warehouse with a listed set of activities has been mis-declared.",
      "additionalProperties": false,
      "properties": {
        "hooks": {
          "type": "array",
          "description": "Reasons to be here, or things that could happen. One is enough from 'sketch' up.",
          "items": { "type": "string" }
        },
        "activities": {
          "type": "array",
          "description": "What the group can actually DO here, as opposed to look at. A location that cannot answer this is a sketch with ambitions, not a scene.",
          "items": { "type": "string" }
        },
        "history": {
          "type": "string",
          "description": "Depth 'standing' only: what happened here before the campaign, and what has happened here during it. Grows in play -- this is what makes a returning group feel continuity rather than repetition."
        },
        "consequences": {
          "type": "string",
          "description": "Depth 'standing' only: how this place changes based on what the players did. A standing location identical on the fifth visit is a backdrop, not a location."
        }
      }
    },

    "playlistRefs": {
      "type": "array",
      "description": "Music/ambience playlists belonging to this location, so arriving somewhere sounds like arriving somewhere, and sounds the same on the fifth visit as the first. Required from depth 'scene' up. Ids into data/campaign/asset-registry.json, same as assetRefs.",
      "items": { "type": "string" }
    },

    "realWorld": {
      "type": "object",
      "description": "Research about the real Kobe geography under this shape -- meant to come from querying data/map/kurose.gpkg (an 'enrich.py' this description has referenced since the schema was first written, but which was never actually built -- confirmed: no such file exists in the repo's history, and this field is empty in all 236 locations promoted so far). Never canon. No string here may appear verbatim in `lore`.",
      "additionalProperties": true,
      "properties": {
        "character": { "type": "string" },
        "dominantLanduse": { "type": ["string", "null"] },
        "buildingCount": { "type": ["integer", "null"] },
        "realNames": { "type": "array", "items": { "type": "string" } }
      }
    },

    "factionRefs": { "type": "array", "items": { "type": "string" } },
    "npcRefs": { "type": "array", "items": { "type": "string" } },
    "episodeRefs": { "type": "array", "items": { "type": "string" } },
    "openQuestionRefs": { "type": "array", "items": { "type": "string" } },
    "bibleRef": { "type": ["string", "null"], "description": "quarantine/ideas/story/bible/locations/<name>.md, for a place that recurs or carries weight." },
    "assetRefs": { "type": "array", "items": { "type": "string" }, "description": "data/campaign/asset-registry.json entry ids." }
  },

  "allOf": [
    {
      "description": "tier 'point' has no footprint: geometry.point carries its position and geometry.rings stays empty. Surfaced 2026-09-18 by the first real point-tier promotion (The Drain Head) -- until then this branch was only ever theoretical.",
      "if": { "properties": { "tier": { "const": "point" } } },
      "then": {
        "properties": {
          "geometry": {
            "required": ["point"],
            "properties": { "rings": { "maxItems": 0 } }
          }
        }
      }
    },
    {
      "description": "tier 'region'/'site' is a real footprint: geometry.rings carries it and geometry.point stays null.",
      "if": { "properties": { "tier": { "enum": ["region", "site"] } } },
      "then": {
        "properties": {
          "geometry": {
            "required": ["rings"],
            "properties": {
              "rings": { "minItems": 1 },
              "point": { "const": null }
            }
          }
        }
      }
    }
  ]
}
