{
  "$schema": "../schema/location.schema.json",
  "id": "the-almshouse-453",
  "type": "location",
  "tier": "site",
  "name": "The Almshouse",
  "nameJa": null,
  "namingPlaceholderRef": null,
  "kind": "civic",
  "tags": [
    "amenity"
  ],
  "classification": null,
  "rank": 5,
  "depth": "named",
  "geometry": {
    "rings": [
      [
        [
          135.21391389,
          34.6644511
        ],
        [
          135.21430319,
          34.66461296
        ],
        [
          135.21463664,
          34.66407243
        ],
        [
          135.21424679,
          34.6639098
        ],
        [
          135.21391389,
          34.6644511
        ]
      ]
    ],
    "point": null
  },
  "pinAnchor": null,
  "derived": {
    "imagePx": [
      [
        [
          7667.5,
          7079.1
        ],
        [
          7689.1,
          7045.5
        ],
        [
          7745.9,
          7081.6
        ],
        [
          7724.3,
          7115.3
        ],
        [
          7667.5,
          7079.1
        ]
      ]
    ],
    "centroidPx": [
      7706.71,
      7080.38
    ],
    "cells": [
      "D4·74"
    ],
    "ref": "D4·74",
    "areaM2": 2692.2,
    "withinRegionRef": "island-centre",
    "containsRefs": [],
    "neighbourRefs": [],
    "sourceSession": "session-20260911-144323",
    "sourceLocalId": "item-453",
    "promotedDate": "2026-09-13"
  },
  "authoring": {
    "note": "amenities and other general city supporting functions and administration.",
    "status": "drafted"
  },
  "lore": {
    "summary": "Subsidised housing for a handful of elderly islanders with nowhere else to go, run out of city funds.",
    "playerFacing": "",
    "gmOnly": ""
  },
  "scene": {
    "hooks": [],
    "activities": [],
    "history": "",
    "consequences": ""
  },
  "realWorld": {},
  "factionRefs": [],
  "npcRefs": [],
  "episodeRefs": [],
  "openQuestionRefs": [],
  "bibleRef": null,
  "assetRefs": [],
  "playlistRefs": []
}
